switch/name,switch/url,switch/price,switch/description
GATERON INK V2 Silent Black Linear Switches,https://kbdfans.com/collections/switches/products/gateron-ink-v2-silent-black-linear-switches,$8.50,Silent black Ink Linear 60 cN operating force 2.0 mm pre travel 4.0 mm total travel PCB mount 5pin MX stem
GATERON INK V2 Blue Tactile Switches,https://kbdfans.com/collections/switches/products/gateron-ink-v2-blue-tactile-switches,$7.50,Ink Blue Tactile and clicky 75 cN operating force 2.0 mm pre travel 4.0 mm total travel PCB mount 5pin MX stem
GATERON INK V2 Yellow Linear Switches,https://kbdfans.com/collections/switches/products/gateron-ink-v2-yellow-linear-switches,$7.50,Ink Yellow Linear 60 cN operating force 1.5 mm pre travel 3.5 mm total travel PCB mount 5pin MX stem
GATERON INK V2 Red Linear Switches,https://kbdfans.com/collections/switches/products/gateron-ink-v2-red-linear-switches,$7.50,Ink Red Linear 45 cN operating force 2.0 mm pre travel 4.0 mm total travel PCB mount 5pin MX stem
GATERON INK V2 Black Linear Switches,https://kbdfans.com/collections/switches/products/gateron-ink-v2-black-switches,$7.50,Ink Black Linear 60 cN operating force 2.0 mm pre travel 4.0 mm total travel PCB mount 5pin MX stem
Cherry MX Hyperglide Green Tactile Switches,https://kbdfans.com/collections/switches/products/cherry-mx-hyperglide-green-tactile-switches,$3.50,Specs Hyperglide 5pins Green Tactile and clicky 70 cN operating force 2.2 mm pre travel 4.0 mm total travel PCB mount 5pin MX stem
Cherry MX Hyperglide Milk Tactile Switches,https://kbdfans.com/collections/switches/products/cherry-mx-hyperglide-milk-tactile-switches,$3.50,Specs Hyperglide 5pins Milk Tactile and clicky 70 cN operating force 2.2 mm pre travel 4.0 mm total travel PCB mount 5pin MX stem
Cherry MX Hyperglide Brown Tactile Switches,https://kbdfans.com/collections/switches/products/cherry-mx-hyperglide-brown-tactile-switches,$3.50,Specs Hyperglide 5pins Brown Tactile 45 cN operating force 2.0 mm pre travel 4.0 mm total travel PCB mount 5pin MX stem
Cherry MX Hyperglide Blue Tactile Switches,https://kbdfans.com/collections/switches/products/cherry-mx-hyperglide-blue-linear-switches,$3.50,Specs Hyperglide 5pins Blue Tactile and clicky 50 cN operating force 2.2 mm pre travel 4.0 mm total travel PCB mount 5pin MX stem
Cherry MX Hyperglide Red Linear Switches,https://kbdfans.com/collections/switches/products/cherry-mx-hyperglide-red-linear-switches,$3.50,Specs Hyperglide 5pins Red Linear 45 cN operating force 2.0 mm pre travel 4.0 mm total travel PCB mount 5pin MX stem
Gateron SMD Yellow Liner Switches,https://kbdfans.com/collections/switches/products/gateron-smd-yellow-liner-switches,$4.00,Specs Yellow Linear 50 cN operating force 2.0 mm pre travel 4.0 mm total travel Plate mount 3pin MX stem
Gateron SMD Clear Liner Switches,https://kbdfans.com/collections/switches/products/gateron-smd-clear-liner-switches,$4.00,Specs Clear Linear 35 cN operating force 2.0 mm pre travel 4.0 mm total travel Plate mount 3pin MX stem
Gateron SMD Green Tactile Switches,https://kbdfans.com/collections/switches/products/gateron-smd-green-tactile-switches,$4.00,Specs Green Tactile and clicky 80 cN operating force 2.3 mm pre travel 4.0 mm total travel Plate mount 3pin MX stem
Gateron SMD Blue Tactile Switches,https://kbdfans.com/collections/switches/products/gateron-smd-blue-tactile-switches,$4.00,Specs Blue Tactile and clicky 60 cN operating force 2.3 mm pre travel 4.0 mm total travel Plate mount 3pin MX stem
Gateron SMD Brown Tactile Switches,https://kbdfans.com/collections/switches/products/gateron-smd-brown-liner-switches,$4.00,Specs Brown Tactile 55 cN operating force 2.0 mm pre travel 4.0 mm total travel Plate mount 3pin MX stem
Gateron SMD Red liner Switches,https://kbdfans.com/collections/switches/products/gateron-smd-red-liner-switches,$4.00,Specs Red Linear 45 cN operating force 2.0 mm pre travel 4.0 mm total travel Plate mount 3pin MX stem
Gateron SMD Black Liner Switches,https://kbdfans.com/collections/switches/products/gateron-smd-black-liner-switches,$4.00,Specs Black Linear 60 cN operating force 2.0 mm pre travel 4.0 mm total travel Plate mount 3pin MX stem
Gateron Box CJ Linear Switches,https://kbdfans.com/collections/switches/products/gateron-cj-linear-switches,$21.00,"SPECS Linear Spring: come with 22 mm long springs Total travel: 3.4 ±0.4 mm Pre-travel: 1.2 ±0.6 mm Operating force: 45 ±15 gf Top Housing: INK Material Stem: POM Bottom Housing: POM 5-Pin, PCB Mount Pre-lubed 35 per unit"
[Restock] Gateron Oil King Linear Switches,https://kbdfans.com/collections/switches/products/gateron-oil-king-linear-switches,$22.75,"Specs Linear Stem: Black POM Actuation: 55±5gf Bottom Force: 65±5gf Spring: 20mm Total Travel: 4.0mm Top Housing: Black Nylon PA66 Bottom Housing: Black INK Housing Material PCB Mount, 5-Pin MX Style Factory Lubed 35 per unit"
Tecsee Purple Pandas Tactile Switches,https://kbdfans.com/collections/switches/products/tecsee-purple-pandas-10pcs,$4.30,Tecsee Purple Pandas specs Tactile 5-pin PCB mounted Progressive Spring Pre-Travel: 2.0mm Total Travel: 3.0mm Actuation: 55g Bottom Out: 67g Stem: POM Top Housing: PME Material Bottom Housing: PME Material Lightly Pre-Lubed MX-Style 10 included in each pack
GATERON Pro Pre-lubed Yellow/Red/Silver Linear Switches,https://kbdfans.com/collections/switches/products/gateron-pro-switch-pre-lubed-3pin-linear,$8.50,Specs Factory lubed switches Yellow Linear Plate mount 3pins Operating force: 50 ±15 gf Pre-travel: 2.0±0.6 mm Total travel: 4.0±0.4 mm MX stem Red Linear Plate mount 3pins Operating force: 45 ±15 gf Pre-travel: 2.0±0.6 mm Total travel: 4.0±0.4 mm MX stem Silver Linear Two-stage switch springs Plate mount 3 pins Actuation：35 gf Bottom-out: 45±5 gf Pre-travel：1.2±0.3 mm Total travel：3.4-0.4 mm lifetime: 80 million MX stem Gateron Pro Silver Sound Test
Cherry MX Black Hyperglide Liner Switches,https://kbdfans.com/collections/switches/products/cherry-mx-black-hyperglide-pcb-mount-switches,$3.50,Cherry MX Black Specs Linear Hyperglide 60 cN operating force 2.0 mm pre-travel 4.0 mm total travel PCB mount 5 pin MX stem Quantity 1 = 10 switches Hand-Lubed Switches Hand lubed by KBDfans Springs lubed with Krytox GPL105 lubricant Four sides of the stem lubed with Krytox GPL205 G0 lubricant Quantity 1 = 10 switches
Tecsee Coral Tactile Switches,https://kbdfans.com/collections/switches/products/tecsee-coral-switch,$6.50,Specs Tactile 5 pins Stem: NYLON 1.8mm Pre-Travel 3.0mm Total Travel 55g Actuation 68g Bottom Out Standard Gold Spring:68g Sold as one pack of 10 switches
Tecsee Carrot Linear Switches,https://kbdfans.com/collections/switches/products/kbdfans-tecsee-carrot-switch,$4.30,Tecsee Carrot Switches are linear switches that utilize Tecsee's proprietary PME housing material. It also incorporates a long-pole stem for a more consistent bottom out. Tecsee Carrot Switches specs Linear 5-pin PCB mounted Top Housing: PME Material Bottom Housing: PME Material Stem: POM Actuation: 55g Bottom Out: 67g Pre-Travel: 2mm Total Travel: 3.5mm Lightly Pre-Lubed MX-Style 10 included in each pack
Gateron blizzard Tactile switches,https://kbdfans.com/collections/switches/products/gateron-snowstorm-switches,$6.50,"Sound Test Details Tactile Pre-lubed switches Actuation：60gf Pretravel: 2.0±0.6 mm Total travel：3.4 mm Max Operation Force: 60±15gf Pom bottom housing, PA66 top housing PCB mount 5pin MX stem Sold as one pack of 10 switches Specification https://drive.google.com/file/d/1Pp2ozZUWx1Ru_jZDHHfDeaE86GdaV4T4/view?usp=sharing"
Kailh BOX Fried Egg Silent Liner Switches,https://kbdfans.com/collections/switches/products/kailh-fried-egg-silent-switch,$6.60,Specs: Linear 5pins Operating force: 42gf Bottom contact force: 60gf Pre-travel: 1.8±0.3mm Total travel: 3.6±0.3mm Mechanical life: 60million times Sold as one pack of 10 switches
Tecsee Ice Candy Linear Switches,https://kbdfans.com/collections/switches/products/tecsee-ice-candy-linear-switches,$6.50,"Specs Linear Nylon stems, PC housing Double gold springs 63.5g Total Travel: 3.5mm PCB mounted (5 Pins) Factory pre-lubed Sold as one pack of 10 switches"
Kailh Box White Owl Clicky Switches,https://kbdfans.com/collections/switches/products/kailh-white-owl-switch,$5.50,Specs: Clicky 5pins Operating force: 46gf Tactile force: ≥70gf Pre-travel:1.8±0.4mm Total travel: 3.6±0.3mm Mechanical life:80million times Light guide transmittance≥90% Sold as one pack of 10 switches
Kailh Box Deep Sea Silent Linear Switches,https://kbdfans.com/collections/switches/products/kailh-deep-sea-gaming-switch-box-silent-switch-with-light-guide-linear10pcs,$6.80,Specs: Linear 3pins Operating force: 45gf Return force: ≥15gf Pre-travel:1.8±0.3mm Total travel: 3.6±0.3mm Mechanical life:100million times Sold as one pack of 10 switches
Kailh Box Red Bean Pudding Linear Switches,https://kbdfans.com/collections/switches/products/kailh-red-bean-pudding-box-switch,$5.50,Specs Linear 5pins Operating force: 45gf Return force: ≥35gf Pre-travel:1.8±0.4mm Total travel: 3.6±0.3mm Light guide transmittance ≥90% Mechanical life: 80million times Sold as one pack of 10 switches
Gateron BOX Ink Black/Pink Linear Switches,https://kbdfans.com/collections/switches/products/gateron-box-ink-black-pink-switch-1-pack-35pcs,$30.50,BOX Ink Pink: Type: Linear Mount: 5 pins Total travel: 3.4±0.4 mm Pre-Travel: 1.2±0.3 mm Operating pressure: 50±10gf Spring: 15.4 mm black coated stainless steel spring BOX Ink Black Type: Linear Mount: 5 pins Total travel: 3.4±0.4 mm Pre-Travel: 1.2±0.3 mm Operating pressure: 60±10gf Spring: 20 mm black coated stainless steel spring Important Note: Sold as one pack of x35 switches
Gateron BOX Ink Black/Pink Linear switches,https://kbdfans.com/collections/switches/products/gateron-box-ink-black-pink-switch,$9.50,BOX Ink Pink Type: Linear Mount: 5 pins Total travel: 3.4±0.4 mm Pre-Travel: 1.2±0.3 mm Operating pressure: 50±10gf Spring: 15.4 mm black coated stainless steel spring BOX Ink Black Type: Linear Mount: 5 pins Total travel: 3.4±0.4 mm Pre-Travel: 1.2±0.3 mm Operating pressure: 60±10gf Spring: 20 mm black coated stainless steel spring Important Note: Sold as one pack of x10 switches
Gateron Caps Milky Yellow Linear Switches,https://kbdfans.com/collections/switches/products/gateron-milky-caps-v2-switches-3pin-35-pcs,$12.00,SPECS Type: Linear Operating force: 50 cN 3 pins Pre-travel: 2.0 mm Total travel: 4.0 mm Mount: Plate mount 3pin Stem: MX style Friendly Reminds 35 per unit come with a Polycarbonate switch testing base. Download specification documents: Click
Tecsee Metal Coated Linear Switches,https://kbdfans.com/collections/switches/products/tecsee-metal-coated-switches,$56.00,"Specs Sold as one pack, 1 pack = 35 switches Laser switch Linear Aluminum Coated over Polycarbonate (PC) Housings UHMWPE Stem 63.5g Double Gold-Plated Springs 5-pins PCB Mounted Golden switch Linear Aluminum Coated over Polycarbonate (PC) Housings UHMWPE Stem 63.5g Double Gold-Plated Springs 5-pins PCB Mounted"
Tecsee Sapphire/ Ruby Switches,https://kbdfans.com/collections/switches/products/tecsee-sapphire-and-ruby-switches,$4.30,"Specs Sold as one pack, 1 pack = 10 switches Sapphire PC mix housing Tactile 5-pin PCB mounted Tactile POM long stem 2mm pre-travel, 3mm total travel 63.5g gold-plated progressive spring Very lightly factory lubed Ruby PC mix housing linear 5-pin PCB mounted POM linear long-pole stem 3.5mm travel 63.5g gold-plated progressive spring Very lightly factory lubed"
GATERON CAPS V2 Brown/ Milky Tactile SWITCHES,https://kbdfans.com/collections/switches/products/gateron-caps-v2-switches-3-pins-10-switches,$2.50,Specs Tactile switches Light factory lube 1 Pack= 10 switches Operating force: 55g Pre-travel: 2.0 mm Total travel: 4.0 mm Plate mount Spring: Brown (Gold-plated); Milky (Silver-plated) 3 pins MX stem
Gateron Pro White One-stage/Two-stage Linear Switches,https://kbdfans.com/collections/switches/products/gateron-pro-white-linear-3-pin-switch-35-pcs,$11.80,SPECIFICATION： Linear 3 pins Operating force 38g Bottom-out 45g 2.0±0.6 mm pre-travel 4.0±0.4 mm total travel Plate mount 3pin MX stem
KBDfans Pre-lubed Switches,https://kbdfans.com/collections/switches/products/pre-lubed-switches,$8.00,"It is sold as one pack of x10 switches, lubed by KBDfans Q: Which kind of lube we use?A: Krytox GPL105: lube the spring. Krytox AUT2045+GPL105 Mix（7:3): lube the switches and stabilizers. Q: Which parts we lube? Spring: overall lubrication Stem: around the stem Stem legs Q: The disclaimer for our lube serviceA: In general, the switch lube service can reduce the switch noise and improve the smoothness. However, regarding the type feeling and sound, we could not satisfy every customer. Q: Shipping time?A: need to wait 7-10 days before shipping"
Gateron Pro Silver Pre-lubed Linear Switches,https://kbdfans.com/collections/switches/products/gateron-pro-silver-switch-3pin,$2.80,Specs Linear 3 pins Two-stage switch springs Actuation：35 gf Bottom-out: 45±5 gf Pre-travel：1.2±0.3 mm Total travel：3.4-0.4 mm Lifetime: 80 million Sound Test
Gateron Pro Pre-lubed Red/Yellow Linear Switches,https://kbdfans.com/collections/switches/products/gateron-pre-lubed-switches-10-pcs,$2.50,Specs Red Linear 45 cN operating force 2.0 mm pre-travel 4.0 mm total travel Plate mount 3pin MX stem Yellow Linear 50 cN operating force 2.0 mm pre-travel 4.0 mm total travel Plate mount 3pin MX stem
GATERON Silver Blizzard Tactile Switches,https://kbdfans.com/collections/switches/products/gateron-ks035-silver-switches-10-pcs,$5.50,SPECIFICATION： Tactile 5 pins Ks035 Actuation：60gf Pre-travel：2.0mm Total travel：3.4 mm Yellow-Gold-plated spring PCB mount 5pin MX stem
Kailh Polia Tactile Switches,https://kbdfans.com/collections/switches/products/kailh-polia-switches,$6.00,Specs: 1 pack = 10 pcs Type Tactile Travel Distance 1.9mm Actuation | 3.8mm Bottom Force 60g Operating | 67g Bottom Manufacturer Kailh Mount Plate Specs Sheet
Novelkeys x Kailh Box Cream Linear Switches,https://kbdfans.com/collections/switches/products/novelkeys-x-kailh-box-cream-swicthes,$7.00,"NovelKeys Box Cream switches are a new linear switch created in the likeness of cream switches, but features the unique BOX housing. The switches are sold in packs of 10. Quantity 1 = 10 switches Specs: Type Linear Travel Distance 2mm Actuation | 4mm Bottom Force 45g Operating | 55g Bottom Manufacturer Kailh Mount PCB"
TTC Golden Red V3 Liner Switches,https://kbdfans.com/collections/switches/products/ttc-golden-red-v3-switches-10pcs,$4.50,It is sold as one pack of 10 switches.
TTC Golden Blue Clicky Switches,https://kbdfans.com/collections/switches/products/ttc-golden-blue-switches,$6.00,Note: sold as one pack of 10 switches. Specs Operating force: 37±5gf Durability: 80million Pre-travel: 2.2±0.3mm Tactile position: 1.0±0.3mm Total travel: 3.5±0.3mm Leaf spring: Gold contact Terminal: Gold contact Characteristics: Clicks
TTC Watermelon Milkshake Tactile Switches,https://kbdfans.com/collections/switches/products/ttc-watermelon-milkshake-switches-10-pcs,$5.50,"SPECS Name: Watermelon Milkshake (WMSwitch) Brand: KeyFirst Manufacturer: TTC KeyFirst custom switch SOLD IN QUANTITIES OF 10 PCS Large tactile ahead Clear tactile feel like cherry brown switches Gold-plated spring Product parameters: Total travel: 4.0mm Paragraph travel: 0.8mm Conduction travel: 2.0mm Paragraph pressure (0.8mm position): 55gf Conduction pressure (2.0mm position): 45gf Bottom pressure (4.0mm position): 63gf Special Process: On the premise of not affecting the performance of the product, the switch stem part is coated with oil and lubricated;"
TTC Bluish White Tactile Switches,https://kbdfans.com/collections/switches/products/ic-ttc-bluish-white-switch-10-pcs,$4.80,
Gateron Caps Gold Yellow Liner switches,https://kbdfans.com/collections/switches/products/gateron-caps-switches,$18.15,"35 per unit, come with Polycarbonate switch testing base. Specs Linear 50 cN operating force 2.0 mm pre-travel 4.0 mm total travel Plate mount 3pin MX stem Download specification documents: Click & Click"
NovelKeys x Kailh BOX Pinks Clicky Switches,https://kbdfans.com/collections/switches/products/novelkeys-x-kailh-box-pinks,$3.40,NovelKeys x Kailh Box Pinks Kailh BOX Switches. BOX switches are IP56 waterproof/dustproof. Only SMD compatible. Not compatible with other LEDS. These switches are sold in packs of 10. Quantity 1 = 10 switches. Box pink Clicky 65g operating force 1.8mm Actuation 3.6mm Bottom Plate mount 3pin MX stem Spec sheet: Click
Kailh BOX Crystal Switches,https://kbdfans.com/collections/switches/products/kailh-box-crystal-switches,$4.50,BOX Crystal Switches. BOX switches are IP56 waterproof/dustproof. Only SMD compatible. Not compatible with other LEDS. PCB Mount These switches are sold in packs of 10. Quantity 1 = 10 switches. BOX Crystal Royal – Tactile | 3.6mm travel | 40g Actuation | 70g Bottom Out BOX Crystal Jade – Clicky | 3.6mm Travel | 55g Actuation | 75g Bottom Out BOX Crystal Navy – Clicky | 3.6mm Travel | 60g Actuation | 90g Bottom Out BOX Crystal Pink – Clicky | 3.6mm Travel | 65g Actuation | 55g Bottom Out Spec sheet coming soon. Please refer to their non Crystal counterparts' spec sheets for sizing info. Crystal Jades are slightly heavier than their non-crystal counterparts.
SWITCHES *50,https://kbdfans.com/collections/switches/products/switches-50,$10.00,Friendly remind： A pack contains 50 switches
Switches x 90,https://kbdfans.com/collections/switches/products/pls-do-not-delete-switches-option,$18.00,Friendly remind: A pack contains 90 switches
SWITCHES *70,https://kbdfans.com/collections/switches/products/switches-70,$14.00,"Friendly remind: A pack contains 70 switches Q: Which kind of lube we use?A: Krytox GPL105: lube the spring. Krytox AUT2045+GPL105 Mix（7:3): lube the switches and stabilizers. Q: Which parts we lube? Spring: overall lubrication Stem: around the stem Stem legs Q: The disclaimer for our lube serviceA: In general, the switch lube service can reduce the switch noise and improve the smoothness. However, regarding the type feeling and sound, we could not satisfy every customer. Q: Shipping time?A: need to wait 2-3 weeks before shipping Sprit Spring Replacement Service 1. This product is only applicable to those who have purchased the Switch Lube Service. 2. Box switches don't support replacing the springs. 3. This Spring Replacement Service does not include Switch Lube Service."
TTC Gold Brown V3 Tactile switches,https://kbdfans.com/collections/switches/products/ttc-gold-brown-v3-switches,$5.00,Specs Tactile 55 cN operating force 2.0 mm pre travel 4.0 mm total travel Plate mount 3pin MX stem
TTC Silent Red V2 Linear Switches,https://kbdfans.com/collections/switches/products/ttc-silent-red-v2-switches,$6.00,Specs Linear 45 cN operating force 1.8 mm pre travel 3.8 mm total travel Plate mount 3pin MX stem
Kailh Box Silent Pink/Brown Switches,https://kbdfans.com/collections/switches/products/kailh-box-silent-switches-pink-brown-1,$6.00,Kailh BOX Silent Switches. BOX switches are IP56 waterproof/dustproof. Only SMD compatible. Not compatible with other LEDs. These switches are sold in packs of 10. Quantity 1 = 10 switches. Kailh BOX Silent Pink Linear 35g Operating force 1.8mm Actuation 3.6mm Bottom Plate mount 3pin MX stem Spec sheet: Click Kailh BOX Silent Brown Tactile 45g Operating force 2mm Actuation 3.6mm Bottom Plate mount 3pin MX stem Spec sheet: Click
Novelkeys X kailh Blueberry Tactile switches,https://kbdfans.com/collections/switches/products/novelkeys-x-kailh-blueberry-swicthes,$6.50,"SPECS Sold in quantities of 10 pcs Tactile | 4.0mm travel | 3.0mm Actuation | 70g Peak Force | 55g Actuation | 80g Bottom Out | PCB Mount Featuring the same material as the Cream switches. Very long tactile bump that ends at 3mm, which is the actuation point."
Pls do not delete it! (70 Switches Option),https://kbdfans.com/collections/switches/products/switch-68-cherry-gateron-zealio-2,$22.00,Friendly remind: A pack contains 70 switches
TTC Gold Pink linear Switches,https://kbdfans.com/collections/switches/products/ttc-gold-pink-mechanical-keyboard-switches,$4.90,"10 switches per pack Switchtype: linear Cover:transparentcover Base:lightgolden Button:GirlyPink Contactpoles:unipolarcontact Contactmaterial:goldalloy Operatingforce:37±5gf Pre-travel:2.0±0.3mm Totaltravel:4.0-0.3mm Duration:100millionkeystrokes Switchingvoltage:2~12VDC Switchingcurrent:10μA~10mADC Contactresistance:500mΩMax Insulationresistance:100MΩMin Being a switch with lightest operating force, the TTC Gold Pink switch brings comfort and smoothness to long time typing & gaming. Straightupanddownlinearswitch,lighterthan ordinary red switch; Smoothoperationandsmoothinputexperience Thetoleranceof±5gramsforceisjust1/3of the ordinary switch (±15 grams force), which makes the feedback of each key stroke consistently; Builtwithqualityelasticmaterialanddouble gold contact structure, the service life is up to 100 million strikes, which is twice that of ordinary mechanical switches. PatentedTTCdualwallstructure,beautifuland exquisite, elegant, dust-proof effect is 3 times that of ordinary switches Dualwallstructure,helpsswitchstaystable https://cdn.shopify.com/s/files/1/1473/3902/files/Gold_Pink.pdf?v=1588662007"
Turquoise Tealios Linear Switches,https://kbdfans.com/collections/switches/products/turquoise-tealios-switches-linear,$12.00,"1 pack = 10 switches 63.5g Turquoise Tealios feature a vibrant Tiffany blue housing and stem, carefully matched to be a vivid and colorful switch that everyone knows and loves."
KBDfans x MITO Custom Laser Cyan/Pink Linear Switches,https://kbdfans.com/collections/switches/products/kbdfans-x-mito-custom-laser-switches,$6.50,Specs Manufactured by Gateron Lifespan: Over 50 million keystrokes Laser switches（Cyan） 60g x10 Linear 60 g bottom force 2.0 mm pre travel 4.0 mm total travel PCB mount 5pin MX stem Laser switches（Pink） 70g x10 Linear 70 g bottom force 2.0 mm pre travel 4.0 mm total travel PCB mount 5pin MX stem
Gateron Milk Black Linear switches,https://kbdfans.com/collections/switches/products/gateron-milk-black-switches,$2.40,Specs Black Linear 60 cN operating force 2.0 mm pre travel 4.0 mm total travel PCB mount 5pin MX stem
Switches x 100,https://kbdfans.com/collections/switches/products/switches-x-100,$20.00,Friendly remind: 100 switches per pack
ZEAL Tealios/Zealios/Healios/Zilents V2 switches,https://kbdfans.com/collections/switches/products/zealios-tealios-zilents,$11.00,"Sold in packs of 10. Quantity 1 = 10 switches SPECS Manufactory: Gateron Brand: Zeal PC Tealios v2- 67g - Linear,Mx switch, Bottom out:67gPCB mount 5-pin,POM stem,PC housing, Total Travel:4mm Zealios v2- 62g -Tactile,Mx switch, Bottom out:62g, PCB mount 5-pin,POM stem,PC housing Zealios v2- 65g -Tactile,Mx switch, Bottom out:65g, PCB mount 5-pin,POM stem,PC housing Zealios v2- 67g -Tactile,Mx switch, Bottom out:67g, PCB mount 5-pin,POM stem,PC housing Zealios v2- 78g -Tactile, Mx switch, Bottom out:78g, PCB mount 5-pin, POM stem, PC housing Zilents v2- 62g - Tactile (Blue),Mx switch, Bottom out:62g, PCB mount 5-pin, POM stem, PC housing Zilents v2- 65g - Tactile (Blue),Mx switch, Bottom out:65g, PCB mount 5-pin, POM stem, PC housing Zilents v2- 67g - Tactile (Blue),Mx switch, Bottom out:67g, PCB mount 5-pin, POM stem, PC housing Zilents v2- 78g - Tactile (Blue),Mx switch, Bottom out:78g, PCB mount 5-pin, POM stem, PC housing Healios- 63.5g - Linear (Orange),Mx switch, Bottom out:63.5g, PCB mount 5-pin, POM stem, PC housing"
ZEAL Rosélios / Sakurios Silent Linear Switches,https://kbdfans.com/collections/switches/products/roselios-sakurios-silent-linear-switches,$12.95,1 pack = 10 switches SPECS Zeal PC Available in quantities of 70 or 110 Rosélios switches: 67 g force Rosélios feature Pantone 189C stem Sakurios switches: 62 g force Sakurios feature Pantone 1765C stem
Cherry MX RGB Pink Silent linear Switches,https://kbdfans.com/collections/switches/products/cherry-mx-rgb-silent-pink-10pcs,$7.50,Specs Linear 45 cN operating force 1.9 mm pre travel 3.7 mm total travel Plate mount 3pin MX stem REVIEW : Cherry MX Silent Red/Pink - Sound Tests https://www.taekeyboards.com/single-post/REVIEW-CHERRY-MX-SILENT-REDPINK---SOUND-TESTS
Novelkeys x Kailh Cream/Cream Chocolate Linear Switches,https://kbdfans.com/collections/switches/products/novelkey-x-kailh-linear-cream-switch,$6.50,"The switches are sold in packs of 10. Quantity 1 = 10 switches. Cream Switches NovelKeys Cream switches are a brand new linear switch. Featuring housing and stem that is made out of self lubricating POM, this linear is a smooth and unique experience. The switch is also a first for Kailh, as it features MX style latching for the housing. NovelKeys Cream - Linear | 4mm travel | 2mm operating | 55g actuation | 70g bottom out NovelKeys x Kailh Cream Chocolate POM Switch - Linear | 4 mm travel | 2 mm operating | 55g actuation | 70g bottom out The parameters are the same as the Novelkeys Cream, Housing and Stem are made from POM material and are custom colors of the Cream Switch"
CHERRY MX RED SILENT Linear Switches,https://kbdfans.com/collections/switches/products/cherry-mx-silent-red,$5.50,Specs Linear 45 cN operating force 1.9 mm pre travel 3.7 mm total travel Plate mount 3pin MX stem Technical Data
CHERRY MX BLACK SILENT Linear Switches,https://kbdfans.com/collections/switches/products/cherry-mx-silent-black,$5.50,Specs Linear 60 cN operating force 1.9 mm pre travel 3.7 mm total travel Plate mount 3pin MX stem Technical Data
